{
	"$schema": "https://json-schema.org/draft/2020-12/schema",
	"$id": "https://ttt.example/schemas/syncpack.json",
	"$comment": "Hand-vendored minimal permissive schema for syncpack's config (.syncpackrc.json). syncpack v15 (the Rust rewrite) publishes NO JSON Schema — it is absent from SchemaStore and ships no schema in its npm package or GitHub dist — so this schema is intentionally NOT in scripts/sync/schemas.ts SCHEMA_SOURCES and is excluded from sync:check. It exists so an editor's $schema resolves offline and `check-jsonschema --check-metaschema` passes. Permissive by design: it pins the shape of the keys this repo uses (indent/sortFirst/sortAz/versionGroups/semverGroups) while allowing other syncpack keys via additionalProperties.",
	"title": "syncpack Configuration",
	"description": "Configuration file for syncpack (.syncpackrc.json) — dependency version consistency and package.json field sorting.",
	"type": "object",
	"properties": {
		"$schema": {
			"type": "string",
			"description": "Path or URL to this JSON Schema, for editor validation."
		},
		"indent": {
			"type": "string",
			"description": "The whitespace used to indent package.json when written (e.g. a tab or spaces)."
		},
		"source": {
			"type": "array",
			"description": "Glob patterns for the package.json files syncpack reads.",
			"items": { "type": "string" }
		},
		"sortFirst": {
			"type": "array",
			"description": "package.json keys hoisted to the top, in this order, before the rest are sorted.",
			"items": { "type": "string" }
		},
		"sortAz": {
			"type": "array",
			"description": "package.json keys whose object/array contents are sorted alphabetically.",
			"items": { "type": "string" }
		},
		"sortPackages": {
			"type": "boolean",
			"description": "Whether to sort the discovered packages."
		},
		"sortExports": {
			"type": "array",
			"description": "Order for the conditions inside an `exports` map.",
			"items": { "type": "string" }
		},
		"formatBugs": {
			"type": "boolean",
			"description": "Normalise the `bugs` field to shorthand when possible."
		},
		"formatRepository": {
			"type": "boolean",
			"description": "Normalise the `repository` field to shorthand when possible."
		},
		"versionGroups": {
			"type": "array",
			"description": "Rules grouping dependencies whose versions must agree (or be pinned/banned).",
			"items": {
				"type": "object",
				"properties": {
					"label": { "type": "string" },
					"dependencies": { "type": "array", "items": { "type": "string" } },
					"dependencyTypes": { "type": "array", "items": { "type": "string" } },
					"specifierTypes": { "type": "array", "items": { "type": "string" } },
					"packages": { "type": "array", "items": { "type": "string" } },
					"pinVersion": { "type": "string" },
					"policy": { "type": "string" },
					"isBanned": { "type": "boolean" },
					"isIgnored": { "type": "boolean" }
				},
				"additionalProperties": true
			}
		},
		"semverGroups": {
			"type": "array",
			"description": "Rules enforcing a semver range style (e.g. exact vs caret) on grouped dependencies.",
			"items": {
				"type": "object",
				"properties": {
					"label": { "type": "string" },
					"range": { "type": "string" },
					"dependencies": { "type": "array", "items": { "type": "string" } },
					"dependencyTypes": { "type": "array", "items": { "type": "string" } },
					"specifierTypes": { "type": "array", "items": { "type": "string" } },
					"packages": { "type": "array", "items": { "type": "string" } },
					"isIgnored": { "type": "boolean" }
				},
				"additionalProperties": true
			}
		}
	},
	"additionalProperties": true
}
