{
	"$schema": "../../../.schemas/syncpack.json",
	"indent": "\t",
	"sortFirst": [
		"$schema",
		"name",
		"version",
		"private",
		"type",
		"description",
		"license",
		"author",
		"homepage",
		"repository",
		"bugs",
		"funding",
		"keywords",
		"engines",
		"packageManager",
		"scripts",
		"dependencies",
		"devDependencies",
		"peerDependencies",
		"peerDependenciesMeta",
		"optionalDependencies",
		"overrides",
		"resolutions",
		"pnpm"
	],
	"sortAz": [
		"dependencies",
		"devDependencies",
		"keywords",
		"optionalDependencies",
		"peerDependencies",
		"resolutions",
		"overrides",
		"scripts"
	],
	"versionGroups": [
		{
			"label": "Use workspace protocol for internal packages",
			"dependencies": ["@foundation/*"],
			"dependencyTypes": ["dev", "peer", "prod"],
			"pinVersion": "workspace:*"
		}
	],
	"semverGroups": [
		{
			"label": "All dependencies use exact versions",
			"range": ""
		}
	]
}
